{
  "schema_version": "2.0",
  "plan_revision_id": "PR-SIM-001",
  "revision": 1,
  "proposal": {
    "schema_version": "2.0",
    "proposal_id": "P-SIM-001",
    "experiment_id": "EXP-SIM-001",
    "source_agent_run_id": "AR-SIM-001",
    "based_on_snapshot_version": 1,
    "requested_resources": [
      "sim-temp",
      "sim-magnet",
      "sim-smu"
    ],
    "tasks": [
      {
        "id": "temperature",
        "kind": "set_temperature",
        "resource_id": "sim-temp",
        "required_resources": [
          "sim-temp"
        ],
        "skill_ref": "set_temperature@1",
        "parameters": {
          "target_kelvin": 295.0
        },
        "depends_on": [],
        "preconditions": [],
        "success_condition": {
          "kind": "stable_window",
          "resource_id": "sim-temp",
          "quantity": "temperature",
          "target": 295.0,
          "unit": "K",
          "tolerance": 0.1,
          "max_slope_per_s": 0.01,
          "min_duration_s": 5,
          "max_age_s": 2
        },
        "timeout_s": 60
      },
      {
        "id": "field",
        "kind": "set_field",
        "resource_id": "sim-magnet",
        "required_resources": [
          "sim-temp",
          "sim-magnet"
        ],
        "skill_ref": "set_field@1",
        "parameters": {
          "target_tesla": 0.0
        },
        "depends_on": [
          "temperature"
        ],
        "preconditions": [
          {
            "kind": "stable_window",
            "resource_id": "sim-temp",
            "quantity": "temperature",
            "target": 295.0,
            "unit": "K",
            "tolerance": 0.1,
            "max_slope_per_s": 0.01,
            "min_duration_s": 5,
            "max_age_s": 2
          }
        ],
        "success_condition": {
          "kind": "stable_window",
          "resource_id": "sim-magnet",
          "quantity": "field",
          "target": 0.0,
          "unit": "T",
          "tolerance": 0.001,
          "max_slope_per_s": 0.01,
          "min_duration_s": 5,
          "max_age_s": 2
        },
        "timeout_s": 60
      },
      {
        "id": "iv",
        "kind": "measure_iv",
        "resource_id": "sim-smu",
        "required_resources": [
          "sim-temp",
          "sim-magnet",
          "sim-smu"
        ],
        "skill_ref": "iv_measurement@1",
        "parameters": {
          "start_ampere": -0.0001,
          "stop_ampere": 0.0001,
          "points": 21,
          "compliance_volt": 0.1
        },
        "depends_on": [
          "field"
        ],
        "preconditions": [
          {
            "kind": "stable_window",
            "resource_id": "sim-temp",
            "quantity": "temperature",
            "target": 295.0,
            "unit": "K",
            "tolerance": 0.1,
            "max_slope_per_s": 0.01,
            "min_duration_s": 5,
            "max_age_s": 2
          },
          {
            "kind": "stable_window",
            "resource_id": "sim-magnet",
            "quantity": "field",
            "target": 0.0,
            "unit": "T",
            "tolerance": 0.001,
            "max_slope_per_s": 0.01,
            "min_duration_s": 5,
            "max_age_s": 2
          }
        ],
        "success_condition": {
          "kind": "dataset_committed"
        },
        "timeout_s": 60
      }
    ],
    "reason": "Simulation-only temperature, field and IV sequence",
    "risk_level": "operator_review",
    "evidence_dataset_ids": []
  },
  "policy_versions": {
    "sim-temp": "sim-policy-1",
    "sim-magnet": "sim-policy-1",
    "sim-smu": "sim-policy-1"
  },
  "capability_versions": {
    "sim-temp": "sim-capability-1",
    "sim-magnet": "sim-capability-1",
    "sim-smu": "sim-capability-1"
  }
}
